MovielID,Name,Gnere,Introduction,Director,Writers,Stars
2651,Frankenstein Meets the Wolf Man (1943) ,Fantasy|Horror|Sci-Fi,"The resurrected Wolf Man, seeking a cure for his malady, enlists the aid of a mad scientist, who claims he will not only rid the Wolf Man of his nocturnal metamorphosis, but also revive the frozen body of Frankenstein's inhuman creation.",Roy William Neill,Curt Siodmak,Lon Chaney Jr.|Ilona Massey|Patric Knowles
2652,The Curse of Frankenstein (1957) ,Horror|Sci-Fi|Thriller,"While awaiting execution for murder, Baron Victor Frankenstein tells the story of a creature he built and brought to life - only for it to behave not as he intended.",Terence Fisher,Jimmy Sangster|Mary Shelley,Peter Cushing|Hazel Court|Robert Urquhart
2653,Son of Dracula (1943) ,Drama|Fantasy|Horror,"When Katherine, a beautiful Southern girl obsessed with thoughts of eternal life, invites Count Alucard to come to her mansion in the U.S., she unleashes a Pandora's box of horror on unsuspecting relatives and neighbors.",Robert Siodmak,Eric Taylor|Curt Siodmak,Lon Chaney Jr.|Robert Paige|Louise Allbritton
2654,The Wolf Man (1941)             ,Comedy|Horror,"Today, Rob takes a look at the originator of the Werewolf genre, starring Lon Chaney Jr., The Wolf Man.",Rob Boor,Rob Boor,Rob Boor
2655,Howling II: Stirba - Werewolf Bitch (1985) ,Horror|Thriller,"A man discovers that his sister was a werewolf, and helps an investigator track down a gang of the monsters through the United States and eastern Europe.",Philippe Mora,Gary Brandner|Robert Sarno,Christopher Lee|Annie McEnroe|Reb Brown
2656,Tarantula (1955) ,Horror|Sci-Fi,A spider escapes from an isolated Arizona desert laboratory experimenting in giantism and grows to tremendous size as it wreaks havoc on the local inhabitants.,Jack Arnold,Robert M. Fresco|Martin Berkeley,John Agar|Mara Corday|Leo G. Carroll
2657,The Rocky Horror Picture Show (1975) ,Comedy|Musical,A newly-engaged couple have a breakdown in an isolated area and must seek shelter at the bizarre residence of Dr. Frank-n-Furter.,Jim Sharman,Richard O'Brien|Jim Sharman,Tim Curry|Susan Sarandon|Barry Bostwick
2658,Terror of the Saucer Race Series - Leo Is in Danger! The Assassin Is a Flying Saucer             ,Action|Sci-Fi|Thriller,"Another saucer, Absorba, has been summoned to earth. Gen suspects it is taking advantage of a boy's kind feelings towards animals.",,,Ryû Manatsu|Yû Fujiki|Keiko Yamada
2659,It Came from Hollywood (1982) ,Documentary|Comedy,Popular comedians watch and give comments about the worst and silliest films from Hollywood.,Malcolm Leo|Andrew Solt,Dana Olsen,Dan Aykroyd|John Candy|Cheech Marin
2660,The Thing from Another World (1951) ,Horror|Sci-Fi,Scientists and American Air Force officials fend off a bloodthirsty alien organism while at a remote arctic outpost.,Christian Nyby|Howard Hawks,Charles Lederer|John W. Campbell Jr.,Kenneth Tobey|Margaret Sheridan|James Arness
2661,It Came from Outer Space (1953) ,Horror|Sci-Fi,A spaceship from another world crashes in the Arizona desert and only an amateur stargazer and a schoolteacher suspect alien influence when the local townsfolk begin to act strangely.,Jack Arnold,Harry Essex|Ray Bradbury,Richard Carlson|Barbara Rush|Charles Drake
2662,War of the Worlds: The Attack             ,Sci-Fi,The adventures of 3 young astronomers and their fight to survive a deadly Martian Invasion,Junaid Syed,Junaid Syed|Tom Jolliffe,Sam Gittins|Vincent Regan|Alhaji Fofana
2663,It Came from Beneath the Sea (1955) ,Horror|Sci-Fi,"A giant, radioactive octopus rises from the Philippine Trench to terrorize the North American Pacific Coast.",Robert Gordon,George Worthing Yates|Harold Jacob Smith,Kenneth Tobey|Faith Domergue|Donald Curtis
2664,Invasion of the Body Snatchers (1956) ,Drama|Horror|Sci-Fi,A small-town doctor learns that the population of his community is being replaced by emotionless alien duplicates.,Don Siegel,Daniel Mainwaring|Jack Finney,Kevin McCarthy|Dana Wynter|Larry Gates
2665,Earth vs. the Flying Saucers (1956) ,Horror|Sci-Fi,Extraterrestrials traveling in high-tech flying saucers contact a scientist as part of a plan to enslave the inhabitants of Earth.,Fred F. Sears,Bernard Gordon|George Worthing Yates,Hugh Marlowe|Joan Taylor|Donald Curtis
2666,It Conquered the World (1956) ,Horror|Sci-Fi,"A well meaning scientist guides an alien monster to Earth from Venus, so that he can rid mankind of feelings and emotions - but only death and sorrow results.",Roger Corman,Lou Rusoff,Peter Graves|Beverly Garland|Lee Van Cleef
2667,The Mole People (1956)             ,Comedy|Drama|Fantasy,Add a Plot »,,,Rich Koz
2668,Swamp Thing (1982) ,Horror|Sci-Fi,"After a violent incident with a special chemical, a research scientist is turned into a swamp plant monster.",Wes Craven,Wes Craven,Louis Jourdan|Adrienne Barbeau|Ray Wise
2669,Pork Chop Hill (1959) ,Action|Drama|War,"During the Korean War peace talks, U.S. troops fight to retake a hill from the Communist Chinese forces.",Lewis Milestone,S.L.A. Marshall|James R. Webb,Gregory Peck|Harry Guardino|Rip Torn
2670,Run Silent Run Deep (1958) ,Action|Drama|War,"A U.S. sub commander, obsessed with sinking a certain Japanese ship, butts heads with his first officer and crew.",Robert Wise,John Gay|Edward L. Beach,Clark Gable|Burt Lancaster|Jack Warden
2671,Notting Hill (1999) ,Comedy|Drama|Romance,The life of a simple bookshop owner changes when he meets the most famous film star in the world.,Roger Michell,Richard Curtis,Hugh Grant|Julia Roberts|Richard McCabe
2672,The Thirteenth Floor (1999) ,Mystery|Sci-Fi|Thriller,A computer scientist running a virtual reality simulation of 1937 becomes the primary suspect when his colleague and mentor is murdered.,Josef Rusnak,Daniel F. Galouye|Josef Rusnak,Craig Bierko|Gretchen Mol|Armin Mueller-Stahl
2673,Mia aioniotita kai mia mera (1998) ,Drama,"Famous writer Alexander is very ill and has little time left to live. He meets a little boy on the street, who is an illegal immigrant from Albania, and goes on a journey with him to take the boy home.",Theodoros Angelopoulos,Theodoros Angelopoulos|Tonino Guerra,Bruno Ganz|Isabelle Renauld|Fabrizio Bentivoglio
2674,The Loss of Sexual Innocence (1999) ,Drama,"Non-linear film tells the sexual story of a film director from his life at age 5, 12 and 16, a man embarking on his first film in 1950s Tunisia, and finally to his current life. Along the 
                    ",Mike Figgis,Mike Figgis,Julian Sands|Saffron Burrows|Stefano Dionisi
2675,The Man with Rain in His Shoes (1998) ,Comedy|Drama|Fantasy,"A shambling, out-of-work actor, desperate to win back the affections of his ex-girlfriend, unexpectedly stumbles upon a way to turn back the clock.",Maria Ripoll,Rafa Russo,Lena Headey|Douglas Henshall|Penélope Cruz
2676,Instinct (1999) ,Drama|Thriller,"When noted anthropologist Dr. Ethan Powell, who left society to live in the jungle is imprisoned for murder, it's up to young psychiatrist Theo Caulder to get through to him.",Jon Turteltaub,Gerald Di Pego|Gerald Di Pego,Anthony Hopkins|Cuba Gooding Jr.|Donald Sutherland
2677,Buena Vista Social Club (1999) ,Documentary|Music,"Aging Cuban musicians whose talents had been virtually forgotten following Castro's takeover of Cuba, are brought out of retirement by Ry Cooder, who travelled to Havana in order to bring the musicians together, resulting in triumphant performances of extraordinary music, and resurrecting the musicians' careers.",Wim Wenders,Wim Wenders|Nick Gold,Compay Segundo|Ibrahim Ferrer|Rubén González
2678,Desert Blues             ,,Add a Plot »,,J. Elvis Weinstein,Mark Banker
2679,Finding North (1998) ,Comedy|Drama|Romance,"Screwball romance involving a woman (Makkena) who gets fired from her job as a bank teller when her friends arrange for a stripper to appear at the bank for her birthday. She then meets a 
                    ",Tanya Wexler,Kim Powers,Wendy Makkena|John Benjamin Hickey|Jonathan Walker
2680,Floating (1997) ,Drama|Romance,A young man struggle to come of age during a violent period of emotional; financial bankruptcy.,William Roth,William Roth,Norman Reedus|Chad Lowe|Will Lyman
2681,Free Enterprise (1998) ,Comedy|Romance,"Two less than successful film producers, approaching mid-life crisis and clinging to their nerdy sci-fi obsessions, suddenly meet their idol: William Shatner.",Robert Meyer Burnett,Mark A. Altman|Robert Meyer Burnett,Rafer Weigel|Eric McCormack|William Shatner
2682,Limbo (1999) ,Adventure|Drama|Thriller,"In an economically devastated Alaskan town, a fisherman with a troublesome past dates a woman whose young daughter does not approve of him. When he witnesses the murder of his shady brother, he, the woman and the kid run to the wilderness.",John Sayles,John Sayles,David Strathairn|Mary Elizabeth Mastrantonio|Vanessa Martinez
2683,Austin Powers: The Spy Who Shagged Me (1999) ,Action|Adventure|Comedy,"Dr. Evil is back and has invented a new time machine that allows him to go back to the 1960s and steal Austin Powers' mojo, inadvertently leaving him ""shagless"".",Jay Roach,Mike Myers|Michael McCullers,Mike Myers|Heather Graham|Michael York
2684,Taxman (1999) ,Comedy|Drama|Fantasy,A town is disrupted with the arrival of a beautiful new tax inspector.,Alain Zaloum,Brenda Newman|Alain Zaloum,Patrick Bergin|Griffith Brewer|Serge Houde
2685,Red Dwarf             ,Adventure|Comedy|Sci-Fi,"The adventures of the last human alive and his friends, stranded three million years into deep space on the mining ship Red Dwarf.",Rob Grant|Doug Naylor,,Chris Barrie|Craig Charles|Danny John-Jules
2686,Le violon rouge (1998) ,Drama|Music|Mystery,"A red-colored violin inspires passion, making its way through three centuries over several owners and countries, eventually ending up at an auction where it may find a new owner.",François Girard,Don McKellar|François Girard,Carlo Cecchi|Jean-Luc Bideau|Christoph Koncz
2687,Tarzan (1999) ,Animation|Adventure|Family,A man raised by gorillas must decide where he really belongs when he discovers he is a human.,Chris Buck|Kevin Lima,Tab Murphy|Bob Tzudiker,Tony Goldwyn|Minnie Driver|Brian Blessed
2688,Tarzan/Desert Blue/The General's Daughter/Run Lola Run             ,Talk-Show,Add a Plot »,,,Roger Ebert|Todd McCarthy
2689,Get Bruce (1999) ,Documentary,"A richly funny behind-the-scenes look at the art of creating comedy. When celebrities need a hilarious punch line, they get Bruce Vilanch, the comic writer behind Hollywood's biggest events.",Andrew J. Kuehn,,Whoopi Goldberg|Bette Midler|Robin Williams
2690,An Ideal Husband (1999) ,Comedy|Romance,"London 1895: Cabinet minister, Sir Chiltern, and bachelor, Lord Goring, are victims of scheming women.",Oliver Parker,Oscar Wilde|Oliver Parker,Rupert Everett|Julianne Moore|Peter Vaughan
2691,La leggenda del pianista sull'oceano (1998) ,Drama|Music|Romance,"A baby boy, discovered in 1900 on an ocean liner, grows into a musical prodigy, never setting foot on land.",Giuseppe Tornatore,Alessandro Baricco|Giuseppe Tornatore,Tim Roth|Pruitt Taylor Vince|Mélanie Thierry
2692,Lola rennt (1998) ,Crime|Drama|Thriller,"After a botched money delivery, Lola has 20 minutes to come up with 100,000 Deutschmarks.",Tom Tykwer,Tom Tykwer,Franka Potente|Moritz Bleibtreu|Herbert Knaup
2693,Trekkies (1997) ,Documentary|Comedy,Denise Crosby takes a first look at the huge fans of "Star Trek" and how the series from around America has affected and shaped their lives.,Roger Nygard,,Denise Crosby|Frank D'Amico|Barbara Adams
2694,Big Daddy (1999) ,Comedy|Drama,"A lazy law school grad adopts a kid to impress his girlfriend, but everything doesn't go as planned and he becomes the unlikely foster father.",Dennis Dugan,Steve Franks|Steve Franks,Adam Sandler|Joey Lauren Adams|Jon Stewart
2695,Who is the 1997 King of the Ring?             ,Action|Sport,"After being crowned the 1997 King of the Ring, Hunter Hearst Helmsley looks to begin his ascension to the top of the WWF. ""Stone Cold"" Steve Austin faces the Hart Foundation's Brian Pillman
                    ",,,Brian Adams|Steve Austin|Gerald Brisco
2696,Dinner & Games (2015) ,Short,Add a Plot »,Josh Miller,Steven Chan|Luciana Faulhaber,Chandra Caldwell|Steven Chan|Joseph Dixon
2697,My Son the Fanatic (1997) ,Comedy|Drama|Romance,Pakistani taxi-driver Parvez and prostitute Bettina find themselves trapped in the middle when Islamic fundamentalists decide to clean up their local town.,Udayan Prasad,Hanif Kureishi|Hanif Kureishi,Om Puri|Rachel Griffiths|Akbar Kurtha
2698,Zone 39 (1996) ,Sci-Fi,"In a time of misery and fear two enemies come together to prevent an apocalypse conspired by their leaders. 40 years of war between the Federated Republics and the New Territories Union has
                    ",John Tatoulis,Deborah Parsons|John Tatoulis,Peter Phelps|Carolyn Bock|William Zappa
2699,Arachnophobia (1990) ,Comedy|Horror|Thriller,A species of South American killer spider hitches a lift to the U.S. in a coffin and starts to breed and kill.,Frank Marshall,Don Jakoby|Al Williams,Jeff Daniels|Julian Sands|John Goodman
2700,"South Park: Bigger, Longer and Uncut             ",Talk-Show,Add a Plot »,,Jayme Schmitt,Jayme Schmitt
2701,Wild Wild West (1999) ,Action|Comedy|Sci-Fi,"The two best special agents in the Wild West must save President Grant from the clutches of a diabolical, wheelchair-bound, steampunk-savvy, Confederate scientist bent on revenge for losing the Civil War.",Barry Sonnenfeld,Jim Thomas|John Thomas,Will Smith|Kevin Kline|Kenneth Branagh
2702,Summer of Sam (1999) ,Crime|Drama|Romance,Spike Lee's take on the "Son of Sam" murders in New York City during the summer of 1977 centering on the residents of an Italian-American Northeast Bronx neighborhood who live in fear and distrust of one another.,Spike Lee,Spike Lee|Victor Colicchio,John Leguizamo|Adrien Brody|Mira Sorvino
2703,Broken Vessels (1998) ,Drama,"A young Pennsylvania man moves to Los Angeles to begin work for an ambulance service. There he is teamed with a supremely confident vet who seemingly has gone through a large number of 
                    ",Scott Ziehl,David Baer|Brent David Fraser,Todd Field|Jason London|Roxana Zal
2704,Les amants du Pont-Neuf (1991) ,Drama|Romance,"Alex, who's homeless and addicted to alcohol, and Michèle, who's losing her sight, form a relationship while sleeping rough on Paris's Pont-Neuf bridge.",Leos Carax,Leos Carax,Juliette Binoche|Denis Lavant|Klaus-Michael Grüber
2705,"Fin août, début septembre (1998) ",Drama|Romance,"A story about the transition from late youth to early maturity, the film follows several friends and lovers as they come to make decisions on how to live their lives--getting a job more in 
                    ",Olivier Assayas,Olivier Assayas,Mathieu Amalric|Virginie Ledoyen|François Cluzet
2706,American Pie (1999) ,Comedy,Four teenage boys enter a pact to lose their virginity by prom night.,Paul Weitz|Chris Weitz,Adam Herz,Jason Biggs|Chris Klein|Thomas Ian Nicholas
2707,Arlington Road (1999) ,Action|Crime|Drama,A man begins to suspect his neighbors are not what they appear to be and their secrets could be deadly.,Mark Pellington,Ehren Kruger,Jeff Bridges|Tim Robbins|Joan Cusack
2708,Conte d'automne (1998) ,Comedy|Drama|Romance,"A widow's best friend tries to find her a new husband, but the ad posted in the newspaper attracts more than one possibility.",Éric Rohmer,Éric Rohmer,Marie Rivière|Béatrice Romand|Alain Libolt
2709,Muppets from Space (1999) ,Adventure|Comedy|Family,"Gonzo is contacted by his alien family through his breakfast cereal. But when the men in black kidnap him, it's up to Kermit and the gang to rescue Gonzo and help him reunite with his long-lost family.",Tim Hill,Jerry Juhl|Joey Mazzarino,Dave Goelz|Steve Whitmire|Bill Barretta
2710,The Blair Witch Project (1999) ,Horror|Mystery,"Three film students vanish after traveling into a Maryland forest to film a documentary on the local Blair Witch legend, leaving only their footage behind.",Daniel Myrick|Eduardo Sánchez,Daniel Myrick|Eduardo Sánchez,Heather Donahue|Michael C. Williams|Joshua Leonard
2711,My Life So Far (1999) ,Biography|Comedy|Drama,"Memoir of the lives of a family growing up on a post World War I British estate headed up by a strong disciplinarian, her daughter, her inventor husband, their ten year old son and his 
                    ",Hugh Hudson,Denis Forman|Simon Donald,Colin Firth|Rosemary Harris|Irène Jacob
2712,Eyes Wide Shut (1999) ,Drama|Mystery|Thriller,"A New York City doctor embarks on a harrowing, night-long odyssey of sexual and moral discovery after his wife reveals a painful secret to him.",Stanley Kubrick,Stanley Kubrick|Frederic Raphael,Tom Cruise|Nicole Kidman|Todd Field
2713,Lake Placid (1999) ,Action|Comedy|Horror,"Three people attempt to stop a gigantic crocodile, who is terrorizing residents in Black Lake, Maine.",Steve Miner,David E. Kelley,Bridget Fonda|Bill Pullman|Oliver Platt
2714,The 1999 Norwood Car Show (1999) ,,Add a Plot »,Tyler Meyer,,
2715,The Velocity of Gary (1998) ,Comedy|Drama|Romance,"Ex porn star Valentino and Gary are in love with each other. But Valentino also has a girlfriend. Tragedy hits them, when Valentino collapses and is hospitalized with AIDS.",Dan Ireland,James Still,Vincent D'Onofrio|Salma Hayek|Thomas Jane
2716,Ghost Busters (1984) ,Action|Comedy|Fantasy,Three former parapsychology professors set up shop as a unique ghost removal service.,Ivan Reitman,Dan Aykroyd|Harold Ramis,Bill Murray|Dan Aykroyd|Sigourney Weaver
2717,Ghostbusters II (1989) ,Action|Comedy|Fantasy,The discovery of a massive river of ectoplasm and a resurgence of spectral activity allows the staff of Ghostbusters to revive the business.,Ivan Reitman,Dan Aykroyd|Harold Ramis,Bill Murray|Dan Aykroyd|Sigourney Weaver
2718,Drop Dead Gorgeous (1999) ,Comedy|Romance|Thriller,A small-town beauty pageant turns deadly as it becomes clear that someone will go to any lengths to win.,Michael Patrick Jann,Lona Williams,Kirsten Dunst|Denise Richards|Ellen Barkin
2719,The Haunting (1999)             ,Comedy|Talk-Show,"Worst remake ever. No, seriously, EVER.",Doug Walker,Doug Walker|Rob Walker,Doug Walker|Rob Walker
2720,Inspector Gadget (1999) ,Action|Adventure|Comedy,A security guard's dreams come true when he is selected to be transformed into a cybernetic police officer.,David Kellogg,Andy Heyward|Jean Chalopin,Matthew Broderick|Rupert Everett|Joely Fisher
2721,Trick (1999) ,Comedy|Music|Romance,"The misadventures of two young gay men, trying to find a place to be alone, one night in Manhattan.",Jim Fall,Jason Schafer,Christian Campbell|John Paul Pitoc|Tori Spelling
2722,Deep Blue Sea (1999) ,Action|Adventure|Sci-Fi,"Searching for a cure to Alzheimer's disease, a group of scientists on an isolated research facility become the prey, as a trio of intelligent sharks fight back.",Renny Harlin,Duncan Kennedy|Donna Powers,Thomas Jane|Saffron Burrows|Samuel L. Jackson
2723,Mystery Men (1999) ,Action|Comedy|Fantasy,A group of inept amateur superheroes must try to save the day when a supervillain threatens to destroy a major superhero and the city.,Kinka Usher,Neil Cuthbert|Bob Burden,Ben Stiller|Janeane Garofalo|William H. Macy
2724,Runaway Bride (1999) ,Comedy|Romance,A reporter is assigned to write a story about a woman who has left a string of fiancés at the altar.,Garry Marshall,Josann McGibbon|Sara Parriott,Julia Roberts|Richard Gere|Joan Cusack
2725,Twin Falls Idaho (1999) ,Drama,Conjoined twins have their relationship tested when a woman takes interest in one of them.,Michael Polish,Mark Polish|Michael Polish,Michael Polish|Mark Polish|Michele Hicks
2726,The Killing (1956) ,Crime|Drama|Film-Noir,Crook Johnny Clay assembles a five man team to plan and execute a daring race-track robbery.,Stanley Kubrick,Stanley Kubrick|Jim Thompson,Sterling Hayden|Coleen Gray|Vince Edwards
2727,Killer's Kiss (1955) ,Crime|Drama|Film-Noir,"Ready to catch a train to his hometown, a washed-up boxer tells us about the strange and twisty events that happened to him the past couple of days.",Stanley Kubrick,Stanley Kubrick,Frank Silvera|Irene Kane|Jamie Smith
2728,Spartacus (1960) ,Adventure|Biography|Drama,The slave Spartacus leads a violent revolt against the decadent Roman Republic.,Stanley Kubrick,Dalton Trumbo|Howard Fast,Kirk Douglas|Laurence Olivier|Jean Simmons
2729,Lolita (1962) ,Crime|Drama|Romance,A middle-aged college professor becomes infatuated with a fourteen-year-old nymphet.,Stanley Kubrick,Vladimir Nabokov|Vladimir Nabokov,James Mason|Shelley Winters|Sue Lyon
2730,Barry Lyndon (1975) ,Adventure|Drama|History,An Irish rogue wins the heart of a rich widow and assumes her dead husband's aristocratic position in 18th-century England.,Stanley Kubrick,Stanley Kubrick|William Makepeace Thackeray,Ryan O'Neal|Marisa Berenson|Patrick Magee
2731,Les quatre cents coups (1959) ,Crime|Drama,"A young boy, left without attention, delves into a life of petty crime.",François Truffaut,François Truffaut|Marcel Moussy,Jean-Pierre Léaud|Albert Rémy|Claire Maurier
2732,Jules et Jim (1962) ,Drama|Romance,Decades of a love triangle concerning two friends and an impulsive woman.,François Truffaut,Henri-Pierre Roché|François Truffaut,Jeanne Moreau|Oskar Werner|Henri Serre
2733,Vibes (1988) ,Adventure|Comedy|Romance,"Two psychics are hired to find the location of a lost Incan city Located somewhere in the Ecuadorian mountains, that is said to hide a great treasure.",Ken Kwapis,Deborah Blum|Lowell Ganz,Cyndi Lauper|Jeff Goldblum|Ramon Bieri
2734,The Mosquito Coast (1986) ,Adventure|Drama|Thriller,An inventor spurns his city life and moves his family into the jungles of Central America to make a utopia.,Peter Weir,Paul Theroux|Paul Schrader,Harrison Ford|Helen Mirren|River Phoenix
2735,The Golden Child (1986)             ,Talk-Show,Add a Plot »,,,
2736,Brighton Beach Memoirs (1986) ,Comedy,"Eugene, a young teenage Jewish boy, recalls his memoirs of his time as an adolescent youth. He goes through the hardships of puberty, sexual fantasy, and living the life of a poor boy in a crowded house.",Gene Saks,Neil Simon|Neil Simon,Blythe Danner|Jonathan Silverman|Stacey Glick
2737,Assassination (1987) ,Action|Drama|Thriller,"A presidential bodyguard is assigned to protect an objecting first lady, as repeated attempts are made on her life.",Peter R. Hunt,Richard Sale,Charles Bronson|Jill Ireland|Stephen Elliott
2738,Crimes of the Heart (1986) ,Comedy|Drama,Three southern sisters try to come to grips with the meaning of their mother's suicide.,Bruce Beresford,Beth Henley|Beth Henley,Diane Keaton|Jessica Lange|Sissy Spacek
2739,The Color Purple: The 'Musical' (2003) ,Documentary|Short|Music,Add a Plot »,Laurent Bouzereau,Laurent Bouzereau,Steven Spielberg|Margaret Avery|Quincy Jones
2740,"Kindred, the Lamb and the Wolf             ",Talk-Show,Add a Plot »,,,
2741,No Mercy (1986) ,Crime|Drama|Romance,"A Chicago detective, seeking to avenge his partner's death, travels to New Orleans, where he unexpectedly becomes involved in a cat and mouse game of survival.",Richard Pearce,James Carabatsos,Richard Gere|Kim Basinger|Jeroen Krabbé
2742,The Private Navy of Sgt. O'Farrell (1968) ,Comedy|War,"During WW2, Sgt. O'Farrell's Pacific unit is demoralized when a Japanese submarine torpedoes an American supply ship containing beer.",Frank Tashlin,Robert M. Fresco|John L. Greene,Bob Hope|Phyllis Diller|Jeffrey Hunter
2743,Native Son (1986) ,Drama|Romance,"In 1940s Chicago, a young black man takes a job as a chauffeur to a white family, which takes a turn for the worse when he accidentally kills the teenage daughter of the couple and then tries to cover it up.",Jerrold Freedman,Richard Wesley|Richard Wright,Victor Love|Matt Dillon|Elizabeth McGovern
2744,Otello (1986) ,Drama|Music,"Verdi's famous opera is brought to life in this production. The immortal tale of the noble Moor and his beautiful young wife, and of his lieutenant, whose jealousy and lust for power lead him to commit the ultimate treason.",Franco Zeffirelli,Arrigo Boito|Franco Zeffirelli,Plácido Domingo|Katia Ricciarelli|Justino Díaz
2745,The Mission (1986) ,Adventure|Drama|History,Eighteenth-century Spanish Jesuits try to protect a remote South American tribe in danger of falling under the rule of pro-slavery Portugal.,Roland Joffé,Robert Bolt,Robert De Niro|Jeremy Irons|Ray McAnally
2746,Little Shop of Horrors (1986) ,Comedy|Horror|Musical,A nerdy florist finds his chance for success and romance with the help of a giant man-eating plant who demands to be fed.,Frank Oz,Howard Ashman|Howard Ashman,Rick Moranis|Ellen Greene|Vincent Gardenia
2747,Little Shop of Horrors (1986) ,Comedy|Horror|Musical,A nerdy florist finds his chance for success and romance with the help of a giant man-eating plant who demands to be fed.,Frank Oz,Howard Ashman|Howard Ashman,Rick Moranis|Ellen Greene|Vincent Gardenia
2748,Allan Quatermain and the Lost City of Gold (1986) ,Action|Adventure|Comedy,"Allan Quatermain once again teams up with Jesse Huston where the discovery of a mysterious old gold piece sends Quatermain looking for his long-lost brother, missing in the wilds of Africa after seeking a lost white race.",Gary Nelson,H. Rider Haggard|Gene Quintano,Richard Chamberlain|Sharon Stone|James Earl Jones
2749,After the Morning After             ,Drama,"""I don't want you to say another word. Save that pretty little mouth of yours. I have plans for it.""",Prudence Sneed,Prudence Sneed|Greg Thomas,Draper Wynston|Nae Su|Andromeda Jones
2750,Radio Days (1987) ,Comedy,A nostalgic look at radio's golden age focusing on one ordinary family and the various performers in the medium.,Woody Allen,Woody Allen,Mia Farrow|Dianne Wiest|Mike Starr
