MovielID,Name,Gnere,Introduction,Director,Writers,Stars
1688,Anastasia (1997) ,Animation|Adventure|Drama,"The last surviving child of the Russian Royal Family joins two con men to reunite with her grandmother, the Dowager Empress, while the undead Rasputin seeks her death.",Don Bluth|Gary Goldman,Susan Gauthier|Bruce Graham,Meg Ryan|John Cusack|Christopher Lloyd
1689,The Man Who Knew Too Little (1997) ,Comedy|Crime|Drama,Wallace Ritchie is mistaken for a spy and must stop a plot to assassinate international leaders at a banquet.,Jon Amiel,Robert Farrar|Robert Farrar,Bill Murray|Joanne Whalley|Peter Gallagher
1690,Alien: Resurrection (1997) ,Action|Horror|Sci-Fi,"200 years after her death, Ellen Ripley is revived as a powerful human/alien hybrid clone. Along with a crew of space pirates, she must again battle the deadly aliens and stop them from reaching Earth.",Jean-Pierre Jeunet,Dan O'Bannon|Ronald Shusett,Sigourney Weaver|Winona Ryder|Dominique Pinon
1691,L'oeil de Vichy (1993) ,Documentary|War,"This movie is only made of archive pictures: the official newsreels that were broadcasted on French movie screens during 1940 and 1944 (the Occupation). Those newsreels were controlled by 
                    ",Claude Chabrol,Jean-Pierre Azéma|Robert O. Paxton,Michel Bouquet|Brian Cox|Maquisard Alfonso
1692,Alien Escape (1997) ,Sci-Fi,"An alien vessel crashes on Earth and is discovered by Cindy, Shauna and Becky, three friends beginning what they think to be a casual vacation in the mountains. The alien creatures, 
                    ",Scott Harris,Tony Assenza,Gail Thackray|Bernie Van De Yacht|Heather Ford
1693,Amistad (1997) ,Biography|Drama|History,"In 1839, the revolt of Mende captives aboard a Spanish owned ship causes a major controversy in the United States when the ship is captured off the coast of Long Island. The courts must decide whether the Mende are slaves or legally free.",Steven Spielberg,David Franzoni,Djimon Hounsou|Matthew McConaughey|Anthony Hopkins
1694,The Apostle (1997) ,Drama,"After his happy life spins out of control, a preacher from Texas changes his name, goes to Louisiana and starts preaching on the radio.",Robert Duvall,Robert Duvall,Robert Duvall|Todd Allen|Paul Bagget
1695,Artemisia (1997) ,Biography|Drama|History,"Artemisia Gentileschi (1593-1653) was one of the first well-known female painters. The movie tells the story of her youth, when she was guided and protected by her father, the painter 
                    ",Agnès Merlet,Patrick Amos|Agnès Merlet,Valentina Cervi|Michel Serrault|Predrag 'Miki' Manojlovic
1696,Bent (1997) ,Drama|History|Romance,"In 1930s Berlin, a gay Jew is sent to a concentration camp under the Nazi regime.",Sean Mathias,Martin Sherman|Martin Sherman,Lothaire Bluteau|Clive Owen|Mick Jagger
1697,The Big Bang Theory of Everything (2019) ,Documentary,Add a Plot »,,,Robert Webb|Kate Bottley|Jen Brister
1698,The Butcher Boy (1997) ,Comedy|Drama,The antisocial son of an alcoholic father and a bipolar mother grows up in 1960s Ireland.,Neil Jordan,Pat McCabe|Neil Jordan,Stephen Rea|Fiona Shaw|Eamonn Owens
1699,My Giant/The Odd Couple II/City of Angels/The Player's Club/The Big One/The Butcher Boy             ,Talk-Show,Add a Plot »,Don DuPree,,Roger Ebert|Gene Siskel
1700,The Man from Down Under (1943) ,Action|Comedy|Drama,"A crusty old Sergeant of the Queen's Australian army in World War I befriends a small orphaned boy and his tiny sister on the night he is to go back to Australia. The Sergeant emotionally 
                    ",Robert Z. Leonard,Bogart Rogers|Mary Kelly,Charles Laughton|Binnie Barnes|Richard Carlson
1701,Deconstructing Harry (1997) ,Comedy,"Suffering from writer's block and eagerly awaiting his writing award, Harry Block remembers events from his past and scenes from his best-selling books as characters, real and fictional, come back to haunt him.",Woody Allen,Woody Allen,Woody Allen|Judy Davis|Julia Louis-Dreyfus
1702,Flubber (1997) ,Comedy|Family|Sci-Fi,"An absent-minded professor discovers ""flubber,"" a rubber-like super-bouncy substance.",Les Mayfield,Samuel W. Taylor|John Hughes,Robin Williams|Marcia Gay Harden|Christopher McDonald
1703,For Richer or Poorer (1997) ,Comedy,An unhappily married Manhattan socialite couple flee from the I.R.S. and end up in Amish country where they pretend to be visiting relatives.,Bryan Spicer,Jana Howington|Steve LuKanic,Tim Allen|Kirstie Alley|Jay O. Sanders
1704,Good Will Hunting (1997) ,Drama|Romance,"Will Hunting, a janitor at M.I.T., has a gift for mathematics, but needs help from a psychologist to find direction in his life.",Gus Van Sant,Matt Damon|Ben Affleck,Robin Williams|Matt Damon|Ben Affleck
1705,Guy (1996) ,Drama,"A young woman with a camera follows a man around to make a documentary about him, something he is not very happy with.",Michael Lindsay-Hogg,Kirby Dick|Renée Missel,Vincent D'Onofrio|Hope Davis|Kimber Riddle
1706,Harlem River Drive (2014) ,Short|Comedy,It's Nothing Like Being In Love And Having Friends In Harlem,,Mark Anthony Benson,Stephen Cofield|Onika Day|John O. Nelson
1707,Home Alone 3 (1997) ,Action|Comedy|Crime,"Alex Pruitt, an 8-year-old boy living in Chicago, must fend off international spies who seek a top-secret computer chip in his toy car.",Raja Gosnell,John Hughes,Alex D. Linz|Olek Krupa|Rya Kihlstedt
1708,Ill Gotten Gains (1997) ,Drama|History,"WEST AFRICA 1869 - Slave trade is illegal. There is a revolt on a slave ship - twenty four men fight for their lives. Out-gunned, the revolt fails but a second uprising is planned.",Joel B. Marsden,Joel B. Marsden|Joel B. Marsden,Djimon Hounsou|Akosua Busia|De'aundre Bonds
1709,Legal Deceit (1997) ,Thriller,"Sydney Banks learns the hard way that being driven and educated is not the path to success. With the help of Todd Hunter her career takes off. Sydney gets pulled into corporate blackmail 
                    ",Monika Harris,Monika Harris,Lela Rochon|Jeffrey Dean Morgan|Phil Morris
1710,Man of Her Dreams (1997) ,Drama|Thriller,"After suspecting her husband is playing the field, a jittery woman finds a sympathetic ear in the form of a strange man. The drawback is that her sensitive new-found friend is an obsessive psychopath.",Martin Kitrosser,Frank Rehwaldt|Greg Walker,William R. Moses|Lysette Anthony|Patrick Cassidy
1711,Midnight in the Garden of Good and Evil (1997) ,Crime|Drama|Mystery,"A visiting city reporter's assignment suddenly revolves around the murder trial of a local millionaire, whom he befriends.",Clint Eastwood,John Berendt|John Lee Hancock,John Cusack|Kevin Spacey|Jack Thompson
1712,La vie est belle (1956) ,Comedy,Add a Plot »,Roger Pierre|Jean-Marc Thibault,Danielle Haïk,Roger Pierre|Jean-Marc Thibault|Noël Roquevert
1713,Mouse Hunt (2008) ,Action,Add a Plot »,,,
1714,Never Met Picasso (1996) ,Comedy|Drama|Romance,"A gay thirty year old lives at home and is in the midst of a serious creative funk. Rejected by numerous art schools and lacking romantic prospects, he looks to his charismatic Uncle Alfred for inspiration.",Stephen Kijak,Stephen Kijak,Alexis Arquette|Georgia Ragsdale|Margot Kidder
1715,Office Killer (1997) ,Comedy|Crime|Horror,"A mousy office worker accidentally kills one of her coworkers, then proceeds to bump off a few others.",Cindy Sherman,Elise MacAdam|Tom Kalin,Carol Kane|Molly Ringwald|Jeanne Tripplehorn
1716,"Other Voices, Other Rooms (1995) ",Drama,"Other Voices, Other Rooms",David Rocksavage,Truman Capote|Sara Flanigan,Lothaire Bluteau|Anna Thomson|David Speck
1717,Scream 2 (1997) ,Horror|Mystery,"Two years after the first series of murders, as Sidney acclimates to college life, someone donning the Ghostface costume begins a new string of killings.",Wes Craven,Kevin Williamson|Kevin Williamson,Neve Campbell|Courteney Cox|David Arquette
1718,Stranger in the House (1997) ,Thriller,"A botched diamond burglary and a dead publishing company executive set off a string of murders and betrayal in this suspensful, nonstop thriller!",Rodney Gibbons,William Hoy|Peter Liapis,Michele Greene|Bruce Dinsmore|Steve Railsback
1719,Chapter Thirteen: The Sweet Hereafter             ,Crime|Drama|Mystery,"Jughead finds himself in an unexpected situation; The truth about Blossoms' family business is revealed, leaving Cheryl to take matters into her own hands.",Lee Toland Krieger,Roberto Aguirre-Sacasa|Roberto Aguirre-Sacasa,K.J. Apa|Lili Reinhart|Camila Mendes
1720,Time Tracers (1997) ,Sci-Fi,"When the discovery of a five-thousand year old artifact of a humanoid reptile leads an investigative reporter to the Kronos Project, he uncovers an experimental device created to send 
                    ",Bret McCormick,Ted Newsom,Rocky Patterson|TJ Myers|Tyler Mason
1721,Titanic (1997) ,Drama|Romance,"A seventeen-year-old aristocrat falls in love with a kind but poor artist aboard the luxurious, ill-fated R.M.S. Titanic.",James Cameron,James Cameron,Leonardo DiCaprio|Kate Winslet|Billy Zane
1722,Tomorrow Never Dies (1997) ,Action|Adventure|Thriller,James Bond sets out to stop a media mogul's plan to induce war between China and the UK in order to obtain exclusive global media coverage.,Roger Spottiswoode,Bruce Feirstein,Pierce Brosnan|Jonathan Pryce|Michelle Yeoh
1723,Twisted (1996) ,Drama,"A retelling of Charles Dickens' classic novel Oliver Twist set in a New York City contemporary underground populated by drag queens, drug abuse and prostitution.",Seth Michael Donsky,Seth Michael Donsky,Ray Aranha|Keivyn McNeill Grayes|Elise Ballard
1724,À toute vitesse (1996) ,Drama|Romance,"A brief extract of four kids' lives somewhere in France. Quentin, who won a writers contest and now pays more attention to his career as an author than to his friends, beautiful Julie, his 
                    ",Gaël Morel,Gaël Morel|Gaël Morel,Élodie Bouchez|Stéphane Rideau|Pascal Cervo
1725,The Education of Little Tree (1997) ,Drama,Little Tree is an 8-year-old Cherokee boy who loses his parents during The Great Depression and begins living with his Indian grandparents and learning the Cherokee way of life.,Richard Friedenberg,Forrest Carter|Earl Hamner Jr.,James Cromwell|Joseph Ashton|Tantoo Cardinal
1726,The Postman (1997) ,Action|Adventure|Drama,A nameless drifter dons a postman's uniform and bag of mail as he begins a quest to inspire hope to the survivors living in post-apocalyptic America.,Kevin Costner,David Brin|Eric Roth,Kevin Costner|Will Patton|Larenz Tate
1727,Monty Roberts: A Real Horse Whisperer (1998) ,Documentary,"Documentary following American horse trainer and Monty Roberts, who is known for his gentle training methods based on natural horsemanship.",Marty Thomas,Monty Roberts|Marty Thomas,John Forsythe|Monty Roberts
1728,The Winter Guest (1997) ,Drama,"A recent widow, who is determined to leave Scotland for Australia with her son, gets an unexpected visit from her aging mother.",Alan Rickman,Sharman Macdonald|Alan Rickman,Phyllida Law|Emma Thompson|Sheila Reid
1729,Jackie Brown (1997) ,Crime|Drama|Thriller,A middle-aged woman finds herself in the middle of a huge conflict that will either make her a profit or cost her life.,Quentin Tarantino,Quentin Tarantino|Elmore Leonard,Pam Grier|Samuel L. Jackson|Robert Forster
1730,Kundun (1997) ,Biography|Drama|History,"From childhood to adulthood, Tibet's fourteenth Dalai Lama deals with Chinese oppression and other problems.",Martin Scorsese,Melissa Mathison,Tenzin Thuthob Tsarong|Gyurme Tethong|Tulku Jamyang Kunga Tenzin
1731,Mr. Magoo (1997) ,Adventure|Comedy|Family,The myopic millionaire defeats jewel smugglers in his usual bumbling manner.,Stanley Tong,Pat Proft|Tom Sherohman,Leslie Nielsen|Kelly Lynch|Matt Keeslar
1732,The Big Lebowski (1998) ,Comedy|Crime|Sport,"Jeff ""The Dude"" Lebowski, mistaken for a millionaire of the same name, seeks restitution for his ruined rug and enlists his bowling buddies to help get it.",Joel Coen|Ethan Coen,Ethan Coen|Joel Coen,Jeff Bridges|John Goodman|Julianne Moore
1733,Afterglow (1997) ,Comedy|Drama|Romance,A handyman with marital problems meets a housewife with the same.,Alan Rudolph,Alan Rudolph,Nick Nolte|Julie Christie|Lara Flynn Boyle
1734,Ma vie en rose (1997) ,Drama,Ludovic is an innocent seven-year-old child who provokes horror in his community when he dresses in girls clothes and insists he's a girl.,Alain Berliner,Alain Berliner|Chris Vander Stappen,Georges Du Fresne|Michèle Laroque|Jean-Philippe Écoffey
1735,Great Expectations (1998) ,Drama|Romance,Modernization of Charles Dickens' classic story finds the hapless Finn as a painter in New York City pursuing his unrequited and haughty childhood love.,Alfonso Cuarón,Charles Dickens|Mitch Glazer,Ethan Hawke|Gwyneth Paltrow|Hank Azaria
1736,The Pompatus of Love (1995) ,Comedy|Drama|Romance,"Four guys sit around drinking beer and talking, trying to figure out the meaning of ""the pompatus of love"" (from the Steve Miller song ""Joker"") and analyzing their relationships with women.",Richard Schenkman,Jon Cryer|Adam Oliensis,Adrian Pasdar|Paige Turco|Arabella Field
1737,The Wedding Gift (2019) ,Short|Drama,"Komal and Aditya have been married for a few years, but some differences cause them to drift apart. The Wedding Gift, they once shared may be the only solution they have left.",Elvis Furtado,Nidhin Cherian|Elvis Furtado,Makarand Upadhyay|Sanjukta Nath|Pavan Naidu
1738,Vermin (1998) ,Comedy|Drama,A woman gets a flat tire in the desert and is abducted by a trio of desert-rat losers.,Chris Innis,Chris Innis,Shaz Bennett|Peter Dryden|Merle Nicks
1739,3 Ninjas: High Noon at Mega Mountain (1998) ,Action|Adventure|Comedy,The three unstoppable Ninja brothers fight to save their hero (Hulk Hogan) and Mega Mountain Amusement Park from the vicious kid-hating Medusa (Loni Anderson).,Sean McNamara,Sean McNamara|Jeff Phillips,Loni Anderson|Hulk Hogan|Jim Varney
1740,Men of Means (1998) ,Action|Drama,"In a world where two men in close proximity will eventually draw guns, Rico ""BULLET"" Burke finds himself at a crossroads. Having long ago ruined his brilliant collegiate football career 
                    ",George Mendeluk,Shane Perez,Michael Paré|Kaela Dobkin|Raymond Serra
1741,El Callejón de los Milagros (1995) ,Drama|Romance,The lives of men and women living on Callejón de los Milagros in Mexico City.,Jorge Fons,Vicente Leñero|Najeeb Mahfouz,Ernesto Gómez Cruz|María Rojo|Salma Hayek
1742,Caught Up (1998) ,Crime|Drama|Thriller,Daryl wants to go straight after years in prison. He meets a cute girl who helps him find an honest job driving. He wants to save up and open a nightclub. But then gems and mayhem pop up.,Darin Scott,Darin Scott,Bokeem Woodbine|Cynda Williams|Damon Saleem
1743,Arguing the World (1997) ,Documentary,"A true story of four Jewish intellectuals born in New York and educated at City College during the 1930s, and their divergent paths over the next six decades.",Joseph Dorman,Joseph Dorman,Daniel Bell|Nathan Glazer|Irving Howe
1744,Firestorm (1998) ,Action|Thriller,"Firefighter Jesse Graves has to save ornithologist Jennifer and other people caught in a forest fire, which was set up by the lawyer of convicted killer Earl Shaye, who escaped from the 
                    ",Dean Semler,Chris Soth,Howie Long|Scott Glenn|William Forsythe
1745,The Fear (1995) ,Horror,"A group of college seniors spending a weekend at a cottage for a psychological experiment called ""fear therapy"" find a lifelike wooden figure called Morty, which triggers everyone's deepest and darkest secrets and emotions.",Vincent Robert,Ron Ford|Ron Ford,Eddie Bowz|Heather Medway|Ann Turkel
1746,Senseless (1998) ,Comedy|Romance,A student gets his senses enhanced by an experimental drug. But abuse is not an option.,Penelope Spheeris,Greg Erb|Craig Mazin,Marlon Wayans|David Spade|Brad Dourif
1747,Wag the Dog (1997) ,Comedy|Drama,"Shortly before an election, a spin-doctor and a Hollywood producer join efforts to fabricate a war in order to cover up a Presidential sex scandal.",Barry Levinson,Larry Beinhart|Hilary Henkin,Dustin Hoffman|Robert De Niro|Anne Heche
1748,Dark City (1998) ,Mystery|Sci-Fi|Thriller,"A man struggles with memories of his past, which include a wife he cannot remember and a nightmarish world no one else ever seems to wake up from.",Alex Proyas,Alex Proyas|Alex Proyas,Rufus Sewell|Kiefer Sutherland|Jennifer Connelly
1749,When the Leading Man Takes a Stand             ,Reality-TV,"To bride Kiara, the only opinion that matters is her grandfathers. But when Kiara falls for a dress over budget, she may risk leaving the salon empty handed. Strength competitor Talia 
                    ",,,
1750,Star Kid (1997) ,Adventure|Family|Sci-Fi,"Spencer Griffith's life changes when a meteor falls into a local junkyard, and he finds a Cybersuit, an exoskeleton with AI from another galaxy. When Spencer puts on the Cybersuit he becomes a different kind of person.",Manny Coto,Manny Coto,Joseph Mazzello|Joey Simmrin|Alex Daniels
1751,The Sixth Man (1997) ,Comedy|Drama|Fantasy,A college athlete returns from the dead to help his brother's basketball team win the NCAA title.,Randall Miller,Christopher Reed|Cynthia Carle,Marlon Wayans|Kadeem Hardison|David Paymer
1752,Hard Rain (1998) ,Action|Crime|Drama,The nephew of an armored-truck driver tries to prevent three million dollars from being taken by a local rival gang during a catastrophic flooding caused by a severe storm.,Mikael Salomon,Graham Yost,Morgan Freeman|Christian Slater|Randy Quaid
1753,Half Baked (1998) ,Comedy|Crime,The story of three not so bright men who come up with a series of crazy schemes to get a friend out of jail.,Tamra Davis,Dave Chappelle|Neal Brennan,Dave Chappelle|Guillermo Díaz|Jim Breuer
1754,Fallen (1998) ,Action|Crime|Drama,"Homicide detective John Hobbes witnesses the execution of serial killer Edgar Reese. Soon after the execution, the killings start again, and they are very similar to Reese's style.",Gregory Hoblit,Nicholas Kazan,Denzel Washington|John Goodman|Donald Sutherland
1755,Shooting Fish (1997) ,Comedy|Crime|Romance,Two con artists' plan to steal enough for a house are twisted when a pretty girl enters the picture.,Stefan Schwartz,Stefan Schwartz|Richard Holmes,Dan Futterman|Stuart Townsend|Kate Beckinsale
1756,The Prophecy II (1998) ,Fantasy|Horror|Thriller,"When the powers of good and evil again descend to Earth in a battle over mankind, the only hope for survival is the unborn child of an innocent woman. With the help of a mysterious stranger, she races to protect her child and save mankind.",Greg Spence,Gregory Widen|Matt Greenberg,Christopher Walken|Russell Wong|Jennifer Beals
1757,Do lok tin si (1995) ,Comedy|Crime|Drama,"This Hong Kong-set crime drama follows the lives of a hitman, hoping to get out of the business, and his elusive female partner.",Kar-Wai Wong,Kar-Wai Wong,Leon Lai|Michelle Reis|Takeshi Kaneshiro
1758,Dangerous Beauty (1998) ,Biography|Drama|Romance,"A Venetian courtesan becomes a hero to her city, but later becomes the target of an inquisition by the Church for witchcraft.",Marshall Herskovitz,Margaret Rosenthal|Jeannine Dominy,Catherine McCormack|Rufus Sewell|Oliver Platt
1759,"O Que é Isso, Companheiro? (1997) ",Action|Drama|History,"Brazillian urban guerrilla fighters kidnap the American Ambassador. Now, the diplomat's life hangs in the balance - helplessly caught between a government unwilling to cooperate - and his fear of the captors themselves.",Bruno Barreto,Fernando Gabeira|Leopoldo Serran,Alan Arkin|Pedro Cardoso|Fernanda Torres
1760,Spice World (1997) ,Comedy|Family|Music,World famous pop group the Spice Girls zip around London in their luxurious double decker tour bus having various adventures and performing for their fans.,Bob Spiers,Spice Girls|Kim Fuller,Mel B|Emma Bunton|Melanie C
1761,Samt El Qusur (1994) ,Drama,"As she grows up, Alia (the daughter of housemaid Khedija) learns the secrets of the peaceful palace where she and her mother live.",Moufida Tlatli,Nouri Bouzid|Moufida Tlatli,Hind Sabri|Ghalya Lacroix|Nejia Ouerghi
1762,Deep Rising (1998) ,Action|Adventure|Horror,"A group of heavily armed hijackers board a luxury ocean liner in the South Pacific Ocean to loot it, only to do battle with a series of large-sized, tentacled, man-eating sea creatures who had already invaded the ship.",Stephen Sommers,Stephen Sommers,Treat Williams|Famke Janssen|Anthony Heald
1763,Kådisbellan (1993) ,Drama,"Stocholm in the 1920s. Young Roland lives with his socialist father, Jewish mother and a boxing brother. His mother sells condoms illegally, and from them, Roland makes slingshots which he 
                    ",Åke Sandgren,Åke Sandgren|Roland Schütt,Jesper Salén|Stellan Skarsgård|Basia Frydman
1764,Tainted (1998) ,Comedy|Thriller,A sarcastic comedy thriller about a vampire who sets out to infect the blood of a hospital and the twenty-something slackers who set out to stop him.,Brian Evans,Sean Farley,Jason Brouwer|T.J. Timon|Ronnie Walsh
1766,Dip huet seung hung (1989) ,Action|Crime|Drama,A disillusioned assassin accepts one last hit in hopes of using his earnings to restore vision to a singer he accidentally blinded.,John Woo,John Woo,Yun-Fat Chow|Danny Lee|Sally Yeh
1765,A Letter from Death Row (1998) ,Crime|Drama|Mystery,"A psychological thriller (or is it?) that takes you through the mind of convicted killer, Michael Raine, and his experiences on death row or does it? Was he guilty of killing his 
                    ",Marvin Baker|Bret Michaels,Bret Michaels,Bret Michaels|Martin Sheen|Kristi Gibson
1767,Music from Another Room (1998) ,Comedy|Drama|Romance,"A man's search for his one true love, whose birth he assisted in as a five-year-old. Starring Jude Law & Gretchen Mol.",Charlie Peters,Charlie Peters,Jude Law|Jennifer Tilly|Gretchen Mol
1768,Mat i syn (1997) ,Drama,A man goes for a walk through the countryside with his dying mother.,Aleksandr Sokurov,Yuriy Arabov,Aleksei Ananishnov|Gudrun Geyer
1769,The Replacement Killers (1998) ,Action|Crime|Thriller,"A troubled hitman seeks aid from a forger to help him get papers to China. However, the drug lord has hired replacements to finish the job, and kill the hitman.",Antoine Fuqua,Ken Sanzel,Yun-Fat Chow|Mira Sorvino|Michael Rooker
1770,B. Monkey (1998) ,Crime|Drama|Romance,A young woman attempts to end her criminal career. But she needs love to make it.,Michael Radford,Andrew Davies|Chloe King,Asia Argento|Jared Harris|Rupert Everett
1771,The Night Flier (1997) ,Fantasy|Horror|Mystery,A reporter is on the trail of a vampiric murderer who travels by plane.,Mark Pavia,Stephen King|Mark Pavia,Miguel Ferrer|Julie Entwisle|Dan Monahan
1772,Blues Brothers 2000 (1998) ,Action|Comedy|Crime,"Elwood must reunite the old band, with a few new members, and go on another ""Mission from God.""",John Landis,Dan Aykroyd|John Landis,Dan Aykroyd|John Goodman|Walter Levine
1773,Tokyo Fist (1995) ,Action|Drama|Thriller,"Suspecting that his childhood friend, a professional boxer, is having a love affair with his fiancée, a businessman starts training rigorously in order to take him down.",Shin'ya Tsukamoto,Hisashi Saito|Shin'ya Tsukamoto,Kaori Fujii|Shin'ya Tsukamoto|Kôji Tsukamoto
1774,Mass Transit (1998) ,Short,Add a Plot »,Kevin Goetz|Michael Goetz,Kevin Goetz|Michael Goetz,
1775,Apur Sansar (1959) ,Drama,This final installment in Satyajit Ray's Apu Trilogy follows Apu's life as an orphaned adult aspiring to be a writer.,Satyajit Ray,Bibhutibhushan Bandyopadhyay|Satyajit Ray,Soumitra Chatterjee|Sharmila Tagore|Alok Chakravarty
1776,Ride (1998) ,Comedy,A group of young people take an old bus from Harlem to Miami to make a rap music video there.,Millicent Shelton,Millicent Shelton,Melissa De Sousa|John Witherspoon|Cedric the Entertainer
1777,The Wedding Singer (1998)             ,Talk-Show,Add a Plot »,,,
1778,Ai qing wan sui (1994) ,Drama,Three lonely young denizens of Taipei unknowingly share an apartment used for sexual trysts.,Ming-liang Tsai,Ming-liang Tsai|Yi-chun Tsai,Chao-jung Chen|Kang-sheng Lee|Kuei-Mei Yang
1779,Sphere (1998) ,Action|Mystery|Sci-Fi,A spaceship is discovered under three hundred years' worth of coral growth at the bottom of the ocean.,Barry Levinson,Michael Crichton|Kurt Wimmer,Dustin Hoffman|Sharon Stone|Samuel L. Jackson
1780,Ayn Rand: A Sense of Life (1997) ,Documentary|Biography,"A documentary focusing on the life of novelist and philosopher Ayn Rand, the author of the bestselling novels The Fountainhead and Atlas Shrugged and originator of the Objectivist philosophy.",Michael Paxton,Michael Paxton,Sharon Gless|Michael S. Berliner|Harry Binswanger
1781,A Further Gesture (1997) ,Drama|Romance|Thriller,"Dowd, who's IRA, escapes an Irish prison in a bloody jailbreak, making his way to New York City where he lives alone, avoids Irish hangouts, and works as a dishwasher. When a good deed gets
                    ",Robert Dornhelm,Ronan Bennett|Stephen Rea,Stephen Rea|Alfred Molina|Rosana Pastor
1782,Caroline and the Little White Lies             ,Comedy|Romance,Del and Charlie pose as a gay couple so as to get cheaper health insurance. Things get difficult when they are invited to a gay party and Del meets a beautiful woman. Richard wants to get on a jury but is having trouble getting selected.,Ted Wass,Fred Barron|Marco Pennette,Lea Thompson|Eric Lutes|Malcolm Gets
1783,Palmetto (1998) ,Crime|Drama|Mystery,A recently released ex-con gets involved in a fake kidnapping scheme that turns very real.,Volker Schlöndorff,James Hadley Chase|E. Max Frye,Woody Harrelson|Elisabeth Shue|Gina Gershon
1784,As Good as It Gets (1997) ,Comedy|Drama|Romance,"A single mother and waitress, a misanthropic author, and a gay artist form an unlikely friendship after the artist is assaulted in a robbery.",James L. Brooks,Mark Andrus|Mark Andrus,Jack Nicholson|Helen Hunt|Greg Kinnear
