MovielID,Name,Gnere,Introduction,Director,Writers,Stars
840,House Arrest (1996) ,Comedy|Family,"A group of children, desperate to keep their various parents from getting divorces, kidnap them and hold them prisoner in a basement in order to force them to reconcile.",Harry Winer,Michael Hitchcock,Jamie Lee Curtis|Kevin Pollak|Kyle Howard
841,Les yeux sans visage (1960) ,Drama|Horror,"A surgeon causes an accident which leaves his daughter disfigured, and goes to extremes to give her a new face.",Georges Franju,Jean Redon|Pierre Boileau,Pierre Brasseur|Alida Valli|Juliette Mayniel
842,Bordello of Blood (1996) ,Comedy|Fantasy|Horror,The Crypt Keeper returns to tell the story of a funeral parlor that moonlights as a vampire bordello.,Gilbert Adler,William M. Gaines|Bob Gale,Dennis Miller|Erika Eleniak|Angie Everhart
843,Lotto Land (1995) ,Drama,"This film tells two interwoven stories of two single-parent families in a poor, racially-mixed neighborhood in Brooklyn. The first story is about a young black man (with aspirations of 
                    ",John Rubino,John Rubino,Lawrence Gilliard Jr.|Wendell Holmes|Barbara Gonzalez
844,Xinghua san yue tian (1994) ,Drama|Romance,"In Northern China, Xinghua lives with her husband, who makes money by selling stones from the Great Wall. But she is unable to give him a son to inherit this wealth. When her husband 
                    ",Li Yin,Ling Shi,Wenli Jiang|Xingli Niu|Shaojun Tian
845,Tian guo ni zi (1994) ,Crime|Drama|Mystery,Guan Jian wants to report the murder of his father who died 10 years ago. The alleged murderer whom Guan Jian accuses of the crime is his own mother.,Ho Yim,Hing-Dong Wong|Ho Yim,Gaowa Siqin|Tsung-Hua Tou|Jingwu Ma
846,Flirt (1995) ,Drama|Romance,"The same situation is played out in different cities (New York, Berlin and Tokyo). A lover has to choose whether to commit to a partner who is returning home. In each case there are other 
                    ",Hal Hartley,Hal Hartley,Paul Austin|Robert John Burke|Martin Donovan
847,The Big Squeeze (1996) ,Drama,"Benny, a lonely drifter, is thrown off a train after cheating at cards, and into the life of Tanya, a lovely bartender. Tanya has been supporting her husband, a former ballplayer, since his
                    ",Marcus DeLeon,Marcus DeLeon,Lara Flynn Boyle|Danny Nucci|Peter Dobson
848,The Spitfire Grill (1996) ,Drama,"Oscar-winner Ellen Burstyn (The Exorcist) headlines this critically praised drama about a young woman, just out of prison, who finds spiritual redemption working at a cafe in Maine.",Lee David Zlotoff,Lee David Zlotoff,Alison Elliott|Ellen Burstyn|Marcia Gay Harden
849,Escape from L.A. (1996) ,Action|Adventure|Sci-Fi,"Snake Plissken is once again called in by the United States government to recover a potential doomsday device from Los Angeles, now an autonomous island where undesirables are deported.",John Carpenter,John Carpenter|Nick Castle,Kurt Russell|Steve Buscemi|Stacy Keach
850,Xích Lô (1995) ,Crime|Drama,"When a poor bicycle-taxi driver has his cyclo stolen, he is forced into a life of crime. Meanwhile, his sister becomes a sex worker.",Anh Hung Tran,Anh Hung Tran,Le Van Loc|Tony Chiu-Wai Leung|Nu Yên-Khê Tran
851,Basquiat (1996) ,Biography|Drama,"The brief life of Jean Michel Basquiat, a world renowned New York street artist struggling with fame, drugs and his identity.",Julian Schnabel,Lech Majewski|John Bowe,Jeffrey Wright|Michael Wincott|Benicio Del Toro
852,Tin Cup (1996) ,Comedy|Drama|Romance,A washed up golf pro working at a driving range tries to qualify for the US Open in order to win the heart of his successful rival's girlfriend.,Ron Shelton,John Norville|Ron Shelton,Kevin Costner|Rene Russo|Don Johnson
853,Goof Troop             ,Animation|Adventure|Comedy,"The classic Disney character Goofy is a single father raising his son, Max, in Spoonerville. Pete, a frequent antagonist from the old cartoons, lives next door with his family.",,,Rob Paulsen|April Winchell|Jim Cummings
854,Narayama bushikô (1958) ,Drama,A kabuki theatre-inflected story about a poor village whose people have to be carried to a nearby mountain to die once they get old.,Keisuke Kinoshita,Shichirô Fukazawa|Keisuke Kinoshita,Kinuyo Tanaka|Teiji Takahashi|Yûko Mochizuki
855,Varannan vecka (2015) ,Short|Drama,"Nadia and Cleo have a step mother-daughter relationship and live together every other week. The entire family is gathered to celebrate Cloe's birthday but things doesn't turn out the way 
                    ",Anette Sidor,Anette Sidor,Ana Gil de Melo Nascimento|Mira Mitchell|Joakim Saedén
856,Mille bolle blu (1993) ,Comedy|Romance,"The movie tells the little stories of a group of families who live in the same building in Rome as seen from the eyes of Sandrino, a little kid who is awaiting for a total eclipse of the 
                    ",Leone Pompucci,Filippo Pichi|Filippo Pichi,Carla Benedetti|Matteo Fadda|Giacomo Fadda
857,Wuya yu maque (1949) ,Drama,A story of a corrupt party official who attempts to sell an apartment building he has appropriated from the original owner and the struggles of the tenants to prevent themselves being thrown onto the street.,Junli Zheng,Baichen Chen|Gu Liu,Dan Zhao|Yinyan Wu|Daolin Sun
858,The Godfather (1972)             ,Comedy,Add a Plot »,Rob Boor,Rob Boor,Rob Boor
859,The Hippie Revolution (1996) ,,"Back in the stone aged we all went to San Fransisco to escape our parents and the Vietnam war. To laugh, dance and love each other. To make love not war.",Jack O'Connell,,Herb Caen|Thomas J. Cahill|Ronnie Davis
860,Der bewegte Mann (1994) ,Comedy,"Thrown out by his girlfriend from her apartment, Axel lives for a while with Norbert, a gay man he met some days before.",Sönke Wortmann,Sönke Wortmann|Ralf König,Til Schweiger|Katja Riemann|Joachim Król
861,Ging chaat goo si III: Chiu kup ging chaat (1992) ,Action|Comedy|Crime,A Hong Kong detective teams up with his female Red Chinese counterpart to stop a Chinese drug czar.,Stanley Tong,Edward Tang|Edward Tang,Jackie Chan|Michelle Yeoh|Maggie Cheung
862,Manny & Lo (1996) ,Comedy|Drama,A pregnant teen and her younger sister run away from foster homes and kidnap a woman whom they believe can help with the pregnancy.,Lisa Krueger,Lisa Krueger,Scarlett Johansson|Aleksa Palladino|Mary Kay Place
863,Cortázar (1994) ,Documentary,"This documentary explores the most important events in the life of the acclaimed writer Julio Cortázar. His childhood accompanied by books, his career as a teacher, his life in Paris and the mass publication of his novels and stories.",Tristán Bauer,Tristán Bauer|Carolina Scaglione,Alfredo Alcón|Hugo Carrizo|Julio Cortázar
864,The Wife (1995) ,Comedy|Drama,"Tom Noonan's dark comedy features a husband-and-wife team of psychotherapists who run a New-Age therapy group out in the wilderness. Late one night, Jack and Rita are visited by one of 
                    ",Tom Noonan,Tom Noonan,Julie Hagerty|Tom Noonan|Wallace Shawn
865,Small Faces (1995) ,Drama,"Three teenage brothers, gang-member Bobby, troubled mama's boy Alan and self-assured prankster Lex, reside in a downtrodden section of Glasgow, Scotland, circa 1968. But while Bobby and 
                    ",Gillies MacKinnon,Billy MacKinnon|Gillies MacKinnon,Iain Robertson|Joe McFadden|Steven Duffy
866,Bound (1996) ,Crime|Thriller,Tough ex-con Corky and her lover Violet concoct a scheme to steal millions of stashed mob money and pin the blame on Violet's crooked boyfriend Caesar.,Lana Wachowski|Lilly Wachowski,Lilly Wachowski|Lana Wachowski,Jennifer Tilly|Gina Gershon|Joe Pantoliano
867,Carpool (1996) ,Comedy,"When his wife falls sick, a father finds himself having to carpool for the neighborhood school children and being taken hostage by a bank robber.",Arthur Hiller,Don Rhymer,Tom Arnold|David Paymer|Rhea Perlman
868,Death in Brunswick (1990) ,Comedy|Crime|Thriller,"Carl Fitzgerald is down-on-his-luck until he meets Sophie, a beautiful Greek girl. He gets a job as a cook, but accidentally kills a fellow worker. He turns to his unscrupulous best friend for help and they attempt to dispose of the body.",John Ruane,John Ruane|Boyd Oxlade,Sam Neill|Zoe Carides|John Clarke
869,Kansas City (1996) ,Crime|Drama|Music,A pair of kidnappings expose the complex power dynamics within the corrupt and unpredictable workings of 1930s Kansas City.,Robert Altman,Robert Altman|Frank Barhydt,Jennifer Jason Leigh|Miranda Richardson|Harry Belafonte
870,Gone Fishin' 1             ,Family|Game-Show,Add a Plot »,Mark Corwin,Merv Griffin,Pat Sajak|Jim Thornton|Vanna White
871,Lover's Knot (1995) ,Comedy|Romance,"Steve Hunter (Billy Campbell) and Megan Forrester (Jennifer Gray), unbeknownst to them, are being guided and ""advised"" by one of Cupid's caseworkers (Tim Curry), who has been struggling to 
                    ",Peter Shaner,Peter Shaner,Billy Campbell|Jennifer Grey|Tim Curry
872,Ai qing wan sui (1994) ,Drama,Three lonely young denizens of Taipei unknowingly share an apartment used for sexual trysts.,Ming-liang Tsai,Ming-liang Tsai|Yi-chun Tsai,Chao-jung Chen|Kang-sheng Lee|Kuei-Mei Yang
873,Schatten der Engel (1976) ,Drama,"Beautiful, detached, laconic, consumptive Lily Brest is a streetwalker with few clients. She loves her idle boyfriend Raoul who gambles away what little she earns. The town's power broker, 
                    ",Daniel Schmid,Rainer Werner Fassbinder|Daniel Schmid,Ingrid Caven|Rainer Werner Fassbinder|Annemarie Düringer
874,Killer: A Journal of Murder (1995) ,Biography|Crime|Drama,"A prison guard at Leavenworth with lofty ideals and hopes of reform struggles to understand a violent, hateful and conscienceless convict. The result is a written testimonial to a crime that no one could have predicted.",Tim Metcalfe,Thomas E. Gaddis|James Long,James Woods|Robert Sean Leonard|Ellen Greene
875,Nothing to Lose (1994) ,Action|Crime|Drama,"A young street fighter seeks revenge against a powerful drug lord who killed his entire family. Using of his many special combat skills, he's about to take down a whole criminal operation, reaching his goal whatever the consequences.",Izidore K. Musallam,,Alexandra Paul|Youssef Abed-Alnour|Paul Gleason
876,Chiu kup gai wak (1993) ,Action|Comedy|Crime,"As a crime wave sweeps through Hong Kong, the police call on Jessica Yang, a rising star in their ranks, to help stop a notorious gang of thieves.",Stanley Tong,Sui Lai Kang|Tang Han Mok,Michelle Yeoh|Rongguang Yu|Emil Chau
877,Girls Town (1996) ,Comedy|Drama,"A look at a group of girl friends coming-of-age during their senior year of high school in urban America. Nikki and Emma have a heart to heart talk one evening about how much they'll miss 
                    ",Jim McKay,Jim McKay|Denise Casano,Lili Taylor|Bruklin Harris|Anna Grace
878,Bye-Bye (1995) ,Drama,"In Paris, Ismaél, a young Tunisian, cares for two brothers, Nouredine, a cripple, and streetwise Mouloud, 14. In haste, Ismaél and Mouloud go to Marseilles where an uncle lives. Nouredine 
                    ",Karim Dridi,Karim Dridi,Sami Bouajila|Nozha Khouadra|Philippe Ambrosini
879,The Relic (1997) ,Horror|Mystery|Sci-Fi,"A homicide detective and an anthropologist try to destroy a South American lizard-like god, who's on a people eating rampage in a Chicago museum.",Peter Hyams,Douglas Preston|Lincoln Child,Penelope Ann Miller|Tom Sizemore|Linda Hunt
880,The Island of Dr Moreau - The Most Disastrous Movie Ever Made             ,Comedy|Talk-Show,Add a Plot »,The Critical Drinker,The Critical Drinker,The Critical Drinker
881,First Kid (1996) ,Family|Comedy,"A former boxer turned Secret Service agent is assigned to protect the President's son, who seems determined to make life difficult for his new protector.",David Mickey Evans,Tim Kelleher,Sinbad|Brock Pierce|Blake Boyd
882,Bogus/The Big Squeeze/Bulletproof/The Trigger Effect/The Island of Dr. Moreau             ,Talk-Show,Add a Plot »,Don DuPree,,Roger Ebert|Gene Siskel
883,Mousehunt (1997) ,Comedy,Two stumblebum inheritors are determined to rid their antique house of a mouse who is equally determined to stay where he is.,Gore Verbinski,Adam Rifkin,Nathan Lane|Lee Evans|Vicki Lewis
884,Sweet Nothing (1995) ,Drama,"Angel celebrates the birth of his daughter by taking his first hit of crack cocaine. With the hesitant support of his wife, Monika, he joins a friend of his to deal drugs for a short time--
                    ",Gary Winick,Lee Drysdale,Michael Imperioli|Mira Sorvino|Joyce Phillips
885,Bogus (1996) ,Comedy|Family|Fantasy,"Recently orphaned, a young boy is taken in by his godmother who is shocked to realize that she can see the boy's imaginary friend: a flamboyant, French magician named Bogus.",Norman Jewison,Jeff Rothberg|Francis X. McCarthy Jr.,Whoopi Goldberg|Gérard Depardieu|Haley Joel Osment
886,Bulletproof (1996) ,Action|Comedy|Crime,"Two criminals, Keats and Moses, end their friendship, when Keats turns out to be an undercover cop. Many years later, the two are forced to work together when Keats is assigned to protect Moses as a witness.",Ernest R. Dickerson,Joe Gayton|Joe Gayton,Damon Wayans|Adam Sandler|James Caan
887,Talk of Angels (1998) ,Drama|Romance|War,"A young Irishwoman becomes governess to 3 daughters of a rich family in Spain in 1936, just before the civil war. The mom likes Franco - the dad doesn't. She becomes family. She befriends 5 Irishwomen.",Nick Hamm,Ann Guedes|Frank McGuinness,Polly Walker|Vincent Perez|Franco Nero
888,The Land Before Time III: The Time of the Great Giving (1995)             ,Animation,Add a Plot »,,,
889,06 (1994) ,Romance|Drama,"Sarah, 30, single, well educated, likes art, places a voice ad for phone sex, inviting replies from men under 35, sturdy and sensual. Wilbert, a chubby middle aged architect, leaves a 
                    ",Theo van Gogh,Johan Doesburg|Johan Doesburg,Ariane Schluter|Ad van Kempen
890,Baton Rouge (1988) ,Crime|Mystery|Romance,"Poor gigolo tries to frame his rich mature mistress, but gets tangled in his own wiles.",Rafael Moleón,Agustín Díaz Yanes|Rafael Moleón,Victoria Abril|Carmen Maura|Antonio Banderas
891,Halloween: The Curse of Michael Myers (1995) ,Horror|Thriller,"Six years after Michael Myers last terrorized Haddonfield, he returns there in pursuit of his niece, Jamie Lloyd, who has escaped with her newborn child, for which Michael and a mysterious cult have sinister plans.",Joe Chappelle,Debra Hill|John Carpenter,Donald Pleasence|Paul Rudd|Marianne Hagan
892,Twelfth Night or What You Will (1996) ,Comedy|Drama|Romance,"Shakespeare's comedy of gender confusion, in which a girl disguises herself as a man to be near the count she adores, only to be pursued by the woman he loves.",Trevor Nunn,William Shakespeare|Trevor Nunn,Helena Bonham Carter|Richard E. Grant|Imogen Stubbs
893,Mother Night (1996) ,Drama|Romance|War,"An American spy behind the lines during WWII serves as a Nazi propagandist, a role he cannot escape in his future life as he can never reveal his real role in the war.",Keith Gordon,Kurt Vonnegut Jr.|Robert B. Weide,Nick Nolte|Sheryl Lee|Anthony J. Robinow
894,Liebelei (1933) ,Drama|Romance,"Vienna in the beginning of the twentieth century. Cavalry Lieutenant Fritz Lobheimer is about to end his affair with Baroness Eggerdorff when he meets the young Christine, the daughter of 
                    ",Max Ophüls,,Paul Hörbiger|Magda Schneider|Luise Ullrich
895,Venice/Venice (1992) ,Drama,"Dean is a maverick American film director surprised that his most recent film has been chosen as the Official U.S. Entry at the Venice Film Festival. A beautiful French journalist arrives 
                    ",Henry Jaglom,Henry Jaglom,Nelly Alard|Henry Jaglom|Melissa Leo
896,Les roseaux sauvages (1994) ,Drama,The fates of two homosexual partners are divided.,André Téchiné,Olivier Massart|Gilles Taurand,Élodie Bouchez|Gaël Morel|Stéphane Rideau
897,For Whom the Bell Tolls (1943) ,Adventure|Drama|History,"During the Spanish Civil War, an American allied with the Republicans finds romance during a desperate mission to blow up a strategically important bridge.",Sam Wood,Dudley Nichols|Ernest Hemingway,Gary Cooper|Ingrid Bergman|Akim Tamiroff
898,Victory Theater: The Philadelphia Story - Great Movies Over Radio             ,Comedy|Mystery,Add a Plot »,,,Adam Graham
899,Singin' in the Rain (1952) ,Comedy|Musical|Romance,A silent film production company and cast make a difficult transition to sound.,Stanley Donen|Gene Kelly,Betty Comden|Adolph Green,Gene Kelly|Donald O'Connor|Debbie Reynolds
900,Paris: An American in Paris             ,History|War,Add a Plot »,,,
901,Funny Face (1957) ,Comedy|Musical|Romance,An impromptu fashion shoot at a book store brings about a new fashion model discovery in the shop clerk.,Stanley Donen,Leonard Gershe,Audrey Hepburn|Fred Astaire|Kay Thompson
902,Breakfast at Tiffany's (1961) ,Comedy|Drama|Romance,"A young New York socialite becomes interested in a young man who has moved into her apartment building, but her past threatens to get in the way.",Blake Edwards,Truman Capote|George Axelrod,Audrey Hepburn|George Peppard|Patricia Neal
903,Vertigo (1958) ,Mystery|Romance|Thriller,A former police detective juggles wrestling with his personal demons and becoming obsessed with a hauntingly beautiful woman.,Alfred Hitchcock,Alec Coppel|Samuel A. Taylor,James Stewart|Kim Novak|Barbara Bel Geddes
904,Rear Window (1954) ,Mystery|Thriller,A wheelchair-bound photographer spies on his neighbors from his apartment window and becomes convinced one of them has committed murder.,Alfred Hitchcock,John Michael Hayes|Cornell Woolrich,James Stewart|Grace Kelly|Wendell Corey
905,It Happened One Night (1934) ,Comedy|Romance,"A renegade reporter and a crazy young heiress meet on a bus heading for New York, and end up stuck with each other when the bus leaves them behind at one of the stops.",Frank Capra,Robert Riskin|Samuel Hopkins Adams,Clark Gable|Claudette Colbert|Walter Connolly
906,Gaslight (1944) ,Crime|Drama|Mystery,"Years after her aunt was murdered in her home, a young woman moves back into the house with her new husband. However, he has a secret that he will do anything to protect, even if it means driving his wife insane.",George Cukor,John Van Druten|Walter Reisch,Charles Boyer|Ingrid Bergman|Joseph Cotten
907,The Gay Divorcee (1934) ,Comedy|Musical|Romance,A woman thinks a flirting man is the co-respondent her lawyer has hired to expedite her divorce.,Mark Sandrich,Dwight Taylor|Kenneth S. Webb,Fred Astaire|Ginger Rogers|Alice Brady
908,North by Northwest (1959) ,Adventure|Mystery|Thriller,A New York City advertising executive goes on the run after being mistaken for a government agent by a group of foreign spies.,Alfred Hitchcock,Ernest Lehman,Cary Grant|Eva Marie Saint|James Mason
909,Don't Trust the B---- in Apartment 23             ,Comedy,"Chloe is a New York party girl with the morals of a pirate. She causes trouble for her naive small town roommate, June, and Chloe's best friend, James Van Der Beek.",Nahnatchka Khan,,Krysten Ritter|Dreama Walker|Michael Blaiklock
910,Some Like It Hot (1959) ,Comedy|Music|Romance,"After two male musicians witness a mob hit, they flee the state in an all-female band disguised as women, but further complications set in.",Billy Wilder,Billy Wilder|I.A.L. Diamond,Marilyn Monroe|Tony Curtis|Jack Lemmon
911,Charade (1963) ,Comedy|Mystery|Romance,Romance and suspense ensue in Paris as a woman is pursued by several men who want a fortune her murdered husband had stolen. Whom can she trust?,Stanley Donen,Peter Stone|Peter Stone,Cary Grant|Audrey Hepburn|Walter Matthau
912,Casablanca (1942) ,Drama|Romance|War,A cynical expatriate American cafe owner struggles to decide whether or not to help his former lover and her fugitive husband escape the Nazis in French Morocco.,Michael Curtiz,Julius J. Epstein|Philip G. Epstein,Humphrey Bogart|Ingrid Bergman|Paul Henreid
913,The Maltese Falcon (1941)             ,Talk-Show,"A private detective takes on a case that involves him with three eccentric criminals, a gorgeous liar, and their quest for a priceless statuette. In this 1941 noir classic, detective Sam 
                    ",James Rolfe,James Rolfe,James Rolfe|Justin Silverman
914,My Fair Lady (1964) ,Drama|Family|Musical,Snobbish phonetics Professor Henry Higgins agrees to a wager that he can make flower girl Eliza Doolittle presentable in high society.,George Cukor,Alan Jay Lerner|George Bernard Shaw,Audrey Hepburn|Rex Harrison|Stanley Holloway
915,Sabrina (1954) ,Comedy|Drama|Romance,"A playboy becomes interested in the daughter of his family's chauffeur, but it's his more serious brother who would be the better man for her.",Billy Wilder,Billy Wilder|Samuel A. Taylor,Humphrey Bogart|Audrey Hepburn|William Holden
916,Roman Holiday (1953) ,Comedy|Romance,A bored and sheltered princess escapes her guardians and falls in love with an American newsman in Rome.,William Wyler,Ian McLellan Hunter|John Dighton,Gregory Peck|Audrey Hepburn|Eddie Albert
917,The Little Princess (1939)             ,Documentary|Biography,A mini-documentary about the making of the 1939 classic The Little Princess (1939).,Manny Velazquez,Manny Velazquez,Shirley Temple
918,Meet Me in St. Louis (1944) ,Comedy|Drama|Family,Young love and childish fears highlight a year in the life of a turn-of-the-century family.,Vincente Minnelli,Irving Brecher|Fred F. Finklehoffe,Judy Garland|Margaret O'Brien|Mary Astor
919,The Wizard of OZ (1939)             ,Comedy|Talk-Show,"This week on THAT MOVIE SHOW, Mike Wendt and Liam Stryker click their heels together and journey down the yellow brick road for a look back at one of the most beloved films of all time - 
                    ",,Eddie McCabe|Mike Wendt,Eddie McCabe|Mike Wendt
920,Gone with the Wind (1939) ,Drama|History|Romance,A manipulative woman and a roguish man conduct a turbulent romance during the American Civil War and Reconstruction periods.,Victor Fleming|George Cukor,Margaret Mitchell|Sidney Howard,Clark Gable|Vivien Leigh|Thomas Mitchell
921,My Favorite Year (1982) ,Comedy|Drama,A dissolute matinee idol is slated to appear on a live TV variety show.,Richard Benjamin,Norman Steinberg|Dennis Palumbo,Peter O'Toole|Mark Linn-Baker|Jessica Harper
922,Sunset Blvd. (1950) ,Drama|Film-Noir,A screenwriter develops a dangerous relationship with a faded film star determined to make a triumphant return.,Billy Wilder,Charles Brackett|Billy Wilder,William Holden|Gloria Swanson|Erich von Stroheim
923,Citizen Kane (1941) ,Drama|Mystery,"Following the death of publishing tycoon Charles Foster Kane, reporters scramble to uncover the meaning of his final utterance; 'Rosebud'.",Orson Welles,Herman J. Mankiewicz|Orson Welles,Orson Welles|Joseph Cotten|Dorothy Comingore
924,2001: A Space Odyssey (1968) ,Adventure|Sci-Fi,"After discovering a mysterious artifact buried beneath the Lunar surface, mankind sets off on a quest to find its origins with help from intelligent supercomputer H.A.L. 9000.",Stanley Kubrick,Stanley Kubrick|Arthur C. Clarke,Keir Dullea|Gary Lockwood|William Sylvester
925,Golden Earrings (1947) ,Adventure|Romance|War,"On the eve of WW2, a British spy goes to Germany to obtain a secret poison-gas formula from a scientist but things go awry and he is saved by a beautiful nomadic gypsy woman.",Mitchell Leisen,Abraham Polonsky|Frank Butler,Ray Milland|Marlene Dietrich|Murvyn Vye
926,All About Eve (1950) ,Drama,A seemingly timid but secretly ruthless ingénue insinuates herself into the lives of an aging Broadway star and her circle of theater friends.,Joseph L. Mankiewicz,Joseph L. Mankiewicz,Bette Davis|Anne Baxter|George Sanders
927,39-45: Les résistantes allemandes (2020) ,Documentary|History,"Coming from all social strata, a priory model citizens of the Third Reich, one thing unites these women: hatred against the Hitler regime and the desire to end the Führer.",Barbara Necek,Audrey Grégoire|Barbara Necek,François Montagut|Anne Nelson|Johannes Tuchel
928,Rebecca (1940) ,Drama|Mystery|Romance,A self-conscious woman juggles adjusting to her new role as an aristocrat's wife and avoiding being intimidated by his first wife's spectral presence.,Alfred Hitchcock,Daphne Du Maurier|Robert E. Sherwood,Laurence Olivier|Joan Fontaine|George Sanders
929,Foreign Correspondent (1940) ,Action|Romance|Thriller,"On the eve of World War II, a young American reporter tries to expose enemy agents in London.",Alfred Hitchcock,Charles Bennett|Joan Harrison,Joel McCrea|Laraine Day|Herbert Marshall
930,Notorious (1946) ,Drama|Film-Noir|Romance,A woman is asked to spy on a group of Nazi friends in South America. How far will she have to go to ingratiate herself with them?,Alfred Hitchcock,Ben Hecht,Cary Grant|Ingrid Bergman|Claude Rains
931,Spellbound (1945) ,Film-Noir|Mystery|Romance,A psychiatrist protects the identity of an amnesia patient accused of murder while attempting to recover his memory.,Alfred Hitchcock,Ben Hecht|John Palmer,Ingrid Bergman|Gregory Peck|Michael Chekhov
932,An Affair to Remember (1957) ,Drama|Musical|Romance,A couple falls in love and agrees to meet in six months at the Empire State Building - but will it happen?,Leo McCarey,Delmer Daves|Leo McCarey,Cary Grant|Deborah Kerr|Richard Denning
933,To Catch a Thief (1955) ,Mystery|Romance|Thriller,A retired jewel thief sets out to prove his innocence after being suspected of returning to his former occupation.,Alfred Hitchcock,John Michael Hayes|David Dodge,Cary Grant|Grace Kelly|Jessie Royce Landis
934,Father of the Bride (1950) ,Comedy|Romance,"The father of a young woman deals with the emotional pain of her getting married, along with the financial and organizational trouble of arranging the wedding.",Vincente Minnelli,Frances Goodrich|Albert Hackett,Spencer Tracy|Joan Bennett|Elizabeth Taylor
